{
  "spec_version": "aac.presentation-manifest/v0",
  "id": "aac.builtin.composed/v0",
  "presentation_api": "aac.presentation-api/v0",
  "runtime_min": "0.1.0",
  "trust_class": "trusted-executable",
  "requires": {
    "bundle_kind": "evidence-bundle/v2",
    "extensions": {
      "required": [
        "composed/v1"
      ]
    }
  },
  "audiences": [
    "*"
  ],
  "formats": [
    "html",
    "fragment",
    "embedded"
  ],
  "fallback": false,
  "priority": 1,
  "executable": {
    "carrier": "core-runtime"
  }
}
