{
  "spec_version": "aac.presentation-manifest/v0",
  "id": "capsuleviewer.receipt.unilateral/v0",
  "presentation_api": "aac.presentation-api/v0",
  "runtime_min": "0.1.0",
  "trust_class": "trusted-executable",
  "requires": {
    "bundle_kind": "evidence-bundle/v2",
    "extensions": {
      "required": [
        "x-deal-v0"
      ]
    }
  },
  "forbids": {
    "profiles": [
      "spec_version:report/v1",
      "spec_version:evaluation-summary/v1",
      "result_version:evidence-result-v0"
    ],
    "extensions": [
      "composed/v1",
      "x-history-selection/v0",
      "x-deal-seller/v0"
    ]
  },
  "audiences": [
    "keep",
    "counterparty",
    "adjudicator"
  ],
  "formats": [
    "html"
  ],
  "fallback": false,
  "priority": 1,
  "executable": {
    "carrier": "module-slot",
    "script_sha256": "7d0e3f88579ca0df8774bd84d3e1883af58aee12de7e903f3adb40162ce6f00c",
    "style_sha256": [
      "3ebe7e581f56665a6a0b5a122fd8447c6be9e06fbcd262e304d83948915d93fd"
    ]
  }
}
