{
  "spec_version": "aac.presentation-manifest/v0",
  "id": "capsulectl.deal-view/v0",
  "presentation_api": "aac.presentation-api/v0",
  "runtime_min": "0.1.0",
  "trust_class": "trusted-executable",
  "requires": {
    "bundle_kind": "evidence-bundle/v2",
    "extensions": {
      "required": ["x-deal-v0"]
    }
  },
  "forbids": {
    "profiles": [
      "spec_version:report/v1",
      "result_version:evidence-result-v0",
      "spec_version:evaluation-summary/v1"
    ]
  },
  "audiences": ["*"],
  "formats": ["html"],
  "fallback": false,
  "priority": 1,
  "executable": {
    "carrier": "module-slot",
    "script_sha256": "dfee5d2bdd705e99fcf7fb63b6fa097c48dedc263f53962556408e94907fe4aa",
    "style_sha256": [
      "033433c0f3b97d682e7b81a8309dd868a96b0ea91f18997b33e097686e7e74da"
    ]
  }
}
