{
  "spec_version": "aac.presentation-manifest/v0",
  "id": "capsuleviewer.receipt.provider/v0",
  "presentation_api": "aac.presentation-api/v0",
  "runtime_min": "0.1.0",
  "trust_class": "trusted-executable",
  "requires": {
    "bundle_kind": "evidence-bundle/v2"
  },
  "forbids": {
    "extensions": ["x-deal-v0", "composed/v1", "x-history-selection/v0"]
  },
  "audiences": ["keep"],
  "formats": ["html"],
  "fallback": false,
  "priority": 1,
  "executable": { "carrier": "core-runtime" }
}
