{
  "spec_version": "aac.presentation-manifest/v0",
  "id": "capsuleviewer.history/v0",
  "presentation_api": "aac.presentation-api/v0",
  "runtime_min": "0.1.0",
  "trust_class": "trusted-executable",
  "requires": {
    "bundle_kind": "evidence-bundle/v2",
    "extensions": {
      "required": [
        "x-history-selection/v0"
      ]
    }
  },
  "forbids": {
    "profiles": [
      "spec_version:report/v1",
      "spec_version:evaluation-summary/v1",
      "result_version:evidence-result-v0"
    ]
  },
  "audiences": [
    "keep",
    "counterparty",
    "adjudicator"
  ],
  "formats": [
    "html"
  ],
  "fallback": false,
  "priority": 1,
  "executable": {
    "carrier": "core-runtime"
  }
}
